{"checks":[{"analysis_unit_id":"project.python","check_id":"python.line","component_id":"project","evidence_complete":true,"language":"python","scope_digest":"sha256:6ff92e3381d66d3ab4d81b5b259d5fc50f7729cdb3e2123827a6be14bbc30ad7","state":"SUCCEEDED","task_id":"project.python.line","variant":null},{"analysis_unit_id":"project.python","check_id":"python.lint","component_id":"project","evidence_complete":false,"language":"python","scope_digest":"sha256:c483cbc9be71b1469ce916b57a401b2b81b70e3db505a2febcd365c99d7521de","state":"SUCCEEDED","task_id":"project.python.lint","variant":null},{"analysis_unit_id":"project.python","check_id":"python.format","component_id":"project","evidence_complete":false,"language":"python","scope_digest":"sha256:b1df79f9d3d35b060ac3f0d23f4e8aab5f1d51fc719d1f6167f5f2ccd2e4d7d4","state":"SUCCEEDED","task_id":"project.python.format","variant":null},{"analysis_unit_id":"project.python","check_id":"python.type","component_id":"project","evidence_complete":false,"language":"python","scope_digest":"sha256:5459bdb39fb5675240a103754f3247d82fa9be5e80d33b9045dda6a8343b8000","state":"BLOCKED","task_id":"project.python.type","variant":null},{"analysis_unit_id":"project.python","check_id":"python.complexity","component_id":"project","evidence_complete":true,"language":"python","scope_digest":"sha256:1f42eb0d962a788f15e5f4d70236f19ba55e13ce7fdc296282e53009ba120072","state":"SUCCEEDED","task_id":"project.python.complexity","variant":null},{"analysis_unit_id":"project.python","check_id":"python.cognitive","component_id":"project","evidence_complete":true,"language":"python","scope_digest":"sha256:f9af113d0b5e12317824e1f51d941d5eef327b11d316696b6d1babb402dba509","state":"SUCCEEDED","task_id":"project.python.cognitive","variant":null},{"analysis_unit_id":"project.python","check_id":"python.cycle","component_id":"project","evidence_complete":true,"language":"python","scope_digest":"sha256:2ab40a3276ed4b962c997cdda5d5ec859132ebf0665e58d15659f62b58638cc1","state":"SUCCEEDED","task_id":"project.python.cycle","variant":null},{"analysis_unit_id":"project.python","check_id":"python.dup","component_id":"project","evidence_complete":true,"language":"python","scope_digest":"sha256:0897e0aac29bd1563c28882a8fd30cf3d3b6646f4e8c73237963ede3d4d91854","state":"SUCCEEDED","task_id":"project.python.dup","variant":null},{"analysis_unit_id":"project.python","check_id":"python.security","component_id":"project","evidence_complete":true,"language":"python","scope_digest":"sha256:9cb970b58183a0c2c6a07f9c51b54f5d1c89030ba2083f2e56ce885ecdef1853","state":"SUCCEEDED","task_id":"project.python.security","variant":null},{"analysis_unit_id":"project.python","check_id":"python.resource","component_id":"project","evidence_complete":true,"language":"python","scope_digest":"sha256:f52af7914dee836301ab2210ba61e9ab4d5f335378bebfd6a269eabe895da780","state":"SUCCEEDED","task_id":"project.python.resource","variant":null},{"analysis_unit_id":"project.python","check_id":"python.exception","component_id":"project","evidence_complete":true,"language":"python","scope_digest":"sha256:f691a8c8dafb5677c8ed82166b487463b3a5fb72dbb57a12193a3fbaf7019157","state":"SUCCEEDED","task_id":"project.python.exception","variant":null},{"analysis_unit_id":"project.python","check_id":"python.dead","component_id":"project","evidence_complete":true,"language":"python","scope_digest":"sha256:ecf1ca81231268f542e485bbc1155fbec3b2deb26363658a1a9fbc333589a3fb","state":"SUCCEEDED","task_id":"project.python.dead","variant":null},{"analysis_unit_id":"project.python","check_id":"python.compat","component_id":"project","evidence_complete":true,"language":"python","scope_digest":"sha256:80a481c658b26cc2e1fe657603a759718bebab4757ec2cb16d3ae119e42253c8","state":"SUCCEEDED","task_id":"project.python.compat","variant":null}],"execution":{"blocked_task_ids":["project.python.type"],"cancelled":false,"failed_task_ids":[],"required_complete":false,"reused_task_ids":[]},"findings":[],"gate":{"has_violations":false,"reasons":["project.python.type: ty: not found; prepare the project tool or install the verified native tool pack"],"selected":"INCOMPLETE","workspace":"NOT_EVALUATED"},"identity":{"fingerprint_version":"ici.next.fingerprint.v3","policy_digest":"sha256:50307e213897dcb9012a6d6efd8b0b55d38fe07097c44bc82c5986aac49b1a78","source":{"digest":"sha256:aa1f781ad9d28a29f0311aca9d4441197f3c7062db064e7868f7b0e3c48c0fe5","dirty":true,"files":["main.py"]},"toolchain_digest":"sha256:2f952b1abc9142feaf49079d723ab3ab7985926b75a1900d2b68aa43e2a3ee63"},"limitations":["native configuration/dependency closure is not complete; cache reuse and resolved-baseline proof are disabled","native imports, user settings, plugins, generated inputs and tool dependency closure are not fully enumerated","ty: not found; prepare the project tool or install the verified native tool pack","Private-symbol references and local unreachable statements are bounded static heuristics; reflective exports and runtime reachability are not proven","No declared Python floor was supplied; syntax and standard-library floors were not asserted","Static API rules cover the documented standard-library inventory; absence of findings is not proof of runtime compatibility","static selection: tests, runtime checks and build artifact checks omitted"],"metrics":[{"evidence":"MEASURED","name":"lines_total","unit":"lines","value":4.0},{"denominator":4,"evidence":"MEASURED","name":"lines_code","numerator":4,"unit":"lines","value":4.0},{"denominator":4,"evidence":"MEASURED","name":"lines_comment","numerator":0,"unit":"lines","value":0.0},{"denominator":4,"evidence":"MEASURED","name":"lines_blank","numerator":0,"unit":"lines","value":0.0},{"denominator":1,"evidence":"MEASURED","name":"files_counted","numerator":1,"unit":"files","value":1.0},{"evidence":"MEASURED","name":"functions_measured","unit":"functions","value":1.0},{"evidence":"MEASURED","name":"max_complexity","unit":"complexity","value":2.0},{"evidence":"MEASURED","name":"functions_measured","unit":"functions","value":1.0},{"evidence":"MEASURED","name":"max_cognitive","unit":"cognitive","value":1.0},{"evidence":"MEASURED","name":"cycles_found","unit":"cycles","value":0.0},{"evidence":"MEASURED","name":"clone_groups","unit":"groups","value":0.0},{"denominator":4,"evidence":"MEASURED","name":"duplicated_lines","numerator":0,"unit":"lines","value":0.0},{"evidence":"MEASURED","name":"files_checked","unit":"files","value":1.0},{"evidence":"MEASURED","name":"issues_found","unit":"issues","value":0.0},{"evidence":"MEASURED","name":"files_checked","unit":"files","value":1.0},{"evidence":"MEASURED","name":"issues_found","unit":"issues","value":0.0},{"evidence":"MEASURED","name":"files_checked","unit":"files","value":1.0},{"evidence":"MEASURED","name":"issues_found","unit":"issues","value":0.0},{"evidence":"MEASURED","name":"files_checked","unit":"files","value":1.0},{"evidence":"ESTIMATED","name":"issues_found","unit":"issues","value":0.0},{"evidence":"MEASURED","name":"files_checked","unit":"files","value":1.0}],"producer":{"ici_version":"0.14.0-dev.0"},"publication":{"detail":"","state":"NOT_CONFIGURED"},"run_id":"20261028T230607.879727083Z-437782","schema_id":"ici.next.run","schema_version":2,"scope":{"full_required_satisfied":false,"kind":"partial","omitted_components":[],"required_components":["project"],"selected_components":["project"],"selected_languages":["python"]}}
