{"checks":[{"analysis_unit_id":null,"check_id":"python.line","component_id":"project","evidence_complete":true,"language":"python","scope_digest":"sha256:5555555555555555555555555555555555555555555555555555555555555555","state":"SUCCEEDED","task_id":"project.python.line","variant":null}],"execution":{"blocked_task_ids":[],"cancelled":false,"failed_task_ids":[],"required_complete":true,"reused_task_ids":[]},"findings":[],"gate":{"has_violations":false,"reasons":[],"selected":"PASS","workspace":"PASS"},"identity":{"fingerprint_version":"ici.next.fingerprint.v3","policy_digest":"sha256:2222222222222222222222222222222222222222222222222222222222222222","source":{"commit":"1a2b3c4d5e6f7a8b9c0d1e2f3a4b5c6d7e8f9a0b","digest":"sha256:1111111111111111111111111111111111111111111111111111111111111111","dirty":false,"files":["apps/gui/widget.cpp","python/tool-a/demo.py"],"generated":["build/ici-default/moc_widget.cpp"]},"toolchain_digest":"sha256:3333333333333333333333333333333333333333333333333333333333333333"},"limitations":[],"metrics":[{"denominator":500,"evidence":"MEASURED","name":"line-coverage","numerator":446,"unit":"percent","value":89.2}],"producer":{"bundle_digest":"sha256:4444444444444444444444444444444444444444444444444444444444444444","ici_version":"0.11.0"},"publication":{"detail":"","state":"NOT_CONFIGURED"},"run_id":"run-20260913-000001","schema_id":"ici.next.run","schema_version":2,"scope":{"full_required_satisfied":true,"kind":"full","omitted_components":[],"required_components":["gui","tool-a"],"selected_components":["gui","tool-a"],"selected_languages":["cpp","python"]}}
