{"checks": [{"analysis_unit_id": "project.python", "check_id": "python.line", "component_id": "project", "evidence_complete": true, "language": "python", "scope_digest": "sha256:4d799e0f3198802c27cee07261de24da37524e899e3a2e262da41a6f6d74889f", "state": "SUCCEEDED", "task_id": "project.python.line", "variant": null}, {"analysis_unit_id": "project.python", "check_id": "python.lint", "component_id": "project", "evidence_complete": true, "language": "python", "scope_digest": "sha256:9aa3e52f7aeb80500143995967bb868a94c1d4278c9304b244fcb8b394356f91", "state": "SUCCEEDED", "task_id": "project.python.lint", "variant": null}, {"analysis_unit_id": "project.python", "check_id": "python.format", "component_id": "project", "evidence_complete": true, "language": "python", "scope_digest": "sha256:f8ac135b39263010c561066b97eb9f8bfd458760c7e2a6014648fa75dd1a9d37", "state": "SUCCEEDED", "task_id": "project.python.format", "variant": null}, {"analysis_unit_id": "project.python", "check_id": "python.type", "component_id": "project", "evidence_complete": true, "language": "python", "scope_digest": "sha256:28572bae22555c71736d92ecdb88214c339e298197fb3869f0dccfbda63c72b0", "state": "SUCCEEDED", "task_id": "project.python.type", "variant": null}, {"analysis_unit_id": "project.python", "check_id": "python.complexity", "component_id": "project", "evidence_complete": true, "language": "python", "scope_digest": "sha256:4d799e0f3198802c27cee07261de24da37524e899e3a2e262da41a6f6d74889f", "state": "SUCCEEDED", "task_id": "project.python.complexity", "variant": null}, {"analysis_unit_id": "project.python", "check_id": "python.cognitive", "component_id": "project", "evidence_complete": true, "language": "python", "scope_digest": "sha256:4d799e0f3198802c27cee07261de24da37524e899e3a2e262da41a6f6d74889f", "state": "SUCCEEDED", "task_id": "project.python.cognitive", "variant": null}, {"analysis_unit_id": "project.python", "check_id": "python.cycle", "component_id": "project", "evidence_complete": true, "language": "python", "scope_digest": "sha256:4d799e0f3198802c27cee07261de24da37524e899e3a2e262da41a6f6d74889f", "state": "SUCCEEDED", "task_id": "project.python.cycle", "variant": null}, {"analysis_unit_id": "project.python", "check_id": "python.dup", "component_id": "project", "evidence_complete": true, "language": "python", "scope_digest": "sha256:4d799e0f3198802c27cee07261de24da37524e899e3a2e262da41a6f6d74889f", "state": "SUCCEEDED", "task_id": "project.python.dup", "variant": null}, {"analysis_unit_id": "project.python", "check_id": "python.security", "component_id": "project", "evidence_complete": true, "language": "python", "scope_digest": "sha256:4d799e0f3198802c27cee07261de24da37524e899e3a2e262da41a6f6d74889f", "state": "SUCCEEDED", "task_id": "project.python.security", "variant": null}, {"analysis_unit_id": "project.python", "check_id": "python.resource", "component_id": "project", "evidence_complete": true, "language": "python", "scope_digest": "sha256:4d799e0f3198802c27cee07261de24da37524e899e3a2e262da41a6f6d74889f", "state": "SUCCEEDED", "task_id": "project.python.resource", "variant": null}, {"analysis_unit_id": "project.python", "check_id": "python.exception", "component_id": "project", "evidence_complete": true, "language": "python", "scope_digest": "sha256:4d799e0f3198802c27cee07261de24da37524e899e3a2e262da41a6f6d74889f", "state": "SUCCEEDED", "task_id": "project.python.exception", "variant": null}, {"analysis_unit_id": "project.python", "check_id": "python.dead", "component_id": "project", "evidence_complete": true, "language": "python", "scope_digest": "sha256:4d799e0f3198802c27cee07261de24da37524e899e3a2e262da41a6f6d74889f", "state": "SUCCEEDED", "task_id": "project.python.dead", "variant": null}, {"analysis_unit_id": "project.python", "check_id": "python.compat", "component_id": "project", "evidence_complete": true, "language": "python", "scope_digest": "sha256:4d799e0f3198802c27cee07261de24da37524e899e3a2e262da41a6f6d74889f", "state": "SUCCEEDED", "task_id": "project.python.compat", "variant": null}], "execution": {"blocked_task_ids": [], "cancelled": false, "failed_task_ids": [], "required_complete": true, "reused_task_ids": []}, "findings": [], "gate": {"has_violations": false, "reasons": [], "selected": "PASS", "workspace": "NOT_EVALUATED"}, "identity": {"fingerprint_version": "ici.next.fingerprint.v3", "policy_digest": "sha256:42fcee170b33eb94bb488606764b6071f114d1a34c29d1ffaea1e8bc14af2428", "source": {"digest": "sha256:7015fc0f0ac52aa32d63afeefe243e21a46986dc2b2067090ad2f3e8d66a1875", "dirty": true, "files": ["main.py"]}, "toolchain_digest": "sha256:b51e59348d1b478ba447e4c0e4e5e182db88b630d101b2c228cadfdbfd6ad7cd"}, "limitations": ["AST-shape semantic clustering is not carried yet — matches are lexical Type-2 clones only", "no requires-python floor could be inferred — the syntax and standard-library floors were not asserted", "static API rules cover a documented standard-library compatibility inventory — absence of a finding is not proof of compatibility", "static selection: tests, runtime checks and build artifact checks omitted", "project: TEM N/A — no coverage evidence — the score is not computed"], "metrics": [{"evidence": "MEASURED", "name": "lines_total", "unit": "lines", "value": 4.0}, {"denominator": 4, "evidence": "MEASURED", "name": "lines_code", "numerator": 4, "unit": "lines", "value": 4.0}, {"denominator": 4, "evidence": "MEASURED", "name": "lines_comment", "numerator": 0, "unit": "lines", "value": 0.0}, {"denominator": 4, "evidence": "MEASURED", "name": "lines_blank", "numerator": 0, "unit": "lines", "value": 0.0}, {"denominator": 1, "evidence": "MEASURED", "name": "files_counted", "numerator": 1, "unit": "files", "value": 1.0}, {"evidence": "MEASURED", "name": "functions_measured", "unit": "functions", "value": 1.0}, {"evidence": "MEASURED", "name": "max_complexity", "unit": "complexity", "value": 2.0}, {"evidence": "MEASURED", "name": "functions_measured", "unit": "functions", "value": 1.0}, {"evidence": "MEASURED", "name": "max_cognitive", "unit": "cognitive", "value": 1.0}, {"evidence": "MEASURED", "name": "cycles_found", "unit": "cycles", "value": 0.0}, {"evidence": "MEASURED", "name": "clone_groups", "unit": "groups", "value": 0.0}, {"denominator": 4, "evidence": "MEASURED", "name": "duplicated_lines", "numerator": 0, "unit": "lines", "value": 0.0}, {"evidence": "MEASURED", "name": "files_checked", "unit": "files", "value": 1.0}, {"evidence": "MEASURED", "name": "issues_found", "unit": "issues", "value": 0.0}, {"evidence": "MEASURED", "name": "files_checked", "unit": "files", "value": 1.0}, {"evidence": "MEASURED", "name": "issues_found", "unit": "issues", "value": 0.0}, {"evidence": "MEASURED", "name": "files_checked", "unit": "files", "value": 1.0}, {"evidence": "MEASURED", "name": "issues_found", "unit": "issues", "value": 0.0}, {"evidence": "MEASURED", "name": "files_checked", "unit": "files", "value": 1.0}, {"evidence": "MEASURED", "name": "issues_found", "unit": "issues", "value": 0.0}, {"evidence": "MEASURED", "name": "files_checked", "unit": "files", "value": 1.0}], "producer": {"ici_version": "0.13.0"}, "publication": {"detail": "", "state": "NOT_CONFIGURED"}, "run_id": "<RUN_ID>", "schema_id": "ici.next.run", "schema_version": 2, "scope": {"full_required_satisfied": false, "kind": "partial", "omitted_components": [], "required_components": ["project"], "selected_components": ["project"], "selected_languages": ["python"]}}
